{
  "client_id": "",
  "company_name": "",
  "sector": "",
  "sub_sector": "",
  "geography": "",
  "audience": "",
  "psychographics": [],
  "products": [],
  "services": [],
  "pricing_model": "",
  "market_position": "",
  "competitors": [],
  "communication_style": "",
  "emotional_positioning": "",
  "visual_preferences": [],
  "typography_preferences": [],
  "color_preferences": [],
  "campaign_history": [],
  "brand_memory": {},
  "visual_memory": {},
  "narrative_memory": {},
  "governance_rules": {},
  "stakeholder_notes": [],
  "timelines": [],
  "deliverables": [],
  "active_projects": [],
  "memory_embeddings": [],
  "retrieval_indexes": []
}

